video_id,title,description,channel,published,views,likes,comments
WycEkH0CJ9w,First Care Activating Serum EX - Find Your Balance,Sulwhasoo's signature product is celebrating 20 years of innovation. First Care Activating Serum EX delivers ultimate radiance to ...,Sulwhasoo US,2017-05-01T17:16:53Z,9799,32.0,1.0
_9WOMw2GLQQ,SULWHASOO SKIN CARE REVIEW | 3 MONTHS AFTER,Finally my update and review of the Sulwhasoo Skin Care Trial Sets! Learn my thoughts 3 months after trialing the two sets ...,All Mod Things,2020-08-24T14:00:38Z,75343,731.0,60.0
SZf2DzvZyTw,Elevate your glow with our First Care Activating Serum VI – a timeless #koreanskincare essential.,"Brighten your skin, reduce visible fine lines, and unveil a smoother, more radiant complexion. Discover the power of ginseng ...",Sulwhasoo US,2025-02-07T01:00:22Z,3122,65.0,0.0
_ZP1zk7G0_Y,Essential Comfort Range🧡     #sulwhasoo #antiaging #skincare #sulwhasooindia,"Your skin needs a boost to stay radiant and healthy. Our First Care Activating Serum VI, enriched with Ginseng and antioxidants, ...",Sulwhasoo India Official,2024-08-23T07:23:10Z,1467,23.0,0.0
NFoP7PSKPKs,SULWHASOO&#39;S BEST SELLER GOT AN UPGRADE! IS IT WORTH IT?👀,The 6th generation of Sulwhasoo's First Care Activating Serum is here!!! Check this new upgrade with me~! I am in love with the ...,EuniUnni,2023-04-12T02:00:11Z,35454,754.0,13.0
EDGOuk5SqDg,"Once my mom finds a product she loves, she’ll never let it go🤩 #skincare #korean #glowyskin",,Aylen Park,2023-10-09T05:33:53Z,11236598,528069.0,4476.0
Ik1lEz3e5ag,"A whole new Sulwhasoo, better than ever before",Coming soon: September 1st. First Care Activating Serum VI.,Sulwhasoo US,2023-08-30T15:59:56Z,1288,25.0,1.0
A1-s0KNoIY8,Sulwhasoo First Care Activating Serum Luxury Premium Kbeauty #luxuryskincare,"Luxury premium Kbeauty Sulwhasoo. This First Care Activating Serum is backed by 23 years of research and newest technology, ...",Shimm Quest,2023-02-26T20:43:06Z,639,9.0,0.0
BuBl1dU7_54,GLASS SKIN WITHOUT MAKEUP? | Sulwhasoo First Care Activating Serum,Today I'm doing a skincare review of a product that is giving me glass skin without makeup. No joke. I've been using it for 20 days ...,Brazilian Girl Channel,2018-06-26T02:07:06Z,11722,135.0,31.0
DSLBK87RlD0,Testing out luxury skincare for a month... is it worth your money?,"As a girly with sensitive acne-prone skin, I wanted to test Sephora's top rated luxury brands and some luxe Korean luxury skincare ...",Christine Le,2023-09-17T15:45:00Z,40865,602.0,39.0
I96YAD9BH_M,Korean Skincare I CAN&#39;T Live Without! *soo good* 🙌,These are the best of the best when it comes to k-beauty and korean skincare! The way I picked these 5 brands among all the ...,Beauty Within,2023-11-30T14:26:39Z,178058,3901.0,90.0
a127nM7Jkgo,Sulwhasoo first care serum - my favourite first step in skincare routine,Shop Sulwhasoo First Care Activating serum https://shopmy.us/collections/122905.,Juliya Yasmin,2023-02-20T05:06:31Z,824,20.0,0.0
sTbcQTNAhFo,SULWHASOO FIRST CARE ACTIVATING SERUM #shorts #shortvideo #youtubeshorts,SULWHASOO FIRST CARE ACTIVATING SERUM #shorts #shortvideo #youtubeshorts Current offer @sulwhasoo.india✨ On ...,Adsas,2023-07-06T13:22:54Z,228,11.0,0.0
KD_a1ERqVCw,"Hydrated, youthful-looking skin in every drop.   #skinbarrier #sulwhasoo #glassskin",First Care Activating Serum VI.,Sulwhasoo US,2023-09-06T23:46:27Z,29202,94.0,0.0
7_0eZUE6-1Q,"Rating &amp; Review Sulwhasoo skincare ( detail in description , click 3 dots )",REVIEW & Rating | in caption below - ✨SULWHASOO GENTLE CLEANING FOAM - Love this cleanser for my dry sensitive acne ...,Shelley Nayak,2023-06-23T13:30:03Z,34467,500.0,17.0
07AVtWTxIzA,Our best-selling First Care Activating Serum VI just got a makeover #rosé #sulwhasoo  #skinbarrier,"Now powered by ginseng, it helps strengthens the skin's barrier, while also addressing premature visible signs of aging.",Sulwhasoo US,2023-09-15T18:00:00Z,596,19.0,0.0
P1ZyO1a30o0,Our best-selling First Care Activating Serum just got a makeover.  #skinbarrier #glassskin,"Now powered by ginseng, it helps strengthen the skin's barrier, while also addressing premature visible signs of aging.",Sulwhasoo US,2023-09-01T04:00:26Z,444,10.0,0.0
VC2i_IcKSEo,Sulwhasoo The Ultimate S Serum Review: Does This Anti-Aging Formula Really Lift &amp; Firm Skin?,"Sulwhasoo The Ultimate S Serum - Advanced Anti-Aging Face Serum, Korean Skincare, Revives the Look of Skin Elasticity for ...",Beautyistic,2025-05-23T08:28:44Z,7,0.0,1.0
A-6BBTINbWk,Start with the best to activate skin&#39;s potential for healthy radiance.,Meet our First Care Activating Serum Limited Edition. #설화수 #Sulwhasoo.,Sulwhasoo US,2023-03-01T19:04:26Z,239,2.0,0.0
_65cc_8lBhM,The NEW Sulwhasoo First Care Activating Serum,,Sulwhasoo US,2021-02-02T01:40:26Z,3154,59.0,1.0
CcZUFaJr9zI,First Care Activating Serum (Sulwhasoo),Sulwhasoo First Care Activating Serum has such a great color and smell. The 5 main ingredients in this popular skincare serum ...,Glow With Gregg,2023-08-09T18:00:11Z,1003,10.0,2.0
7iaQRxfIE2s,skincare products that people in Korea *ACTUALLY* use 😳🇰🇷 #skincare #koreanskincare #shorts,,Edward Zo,2023-11-01T16:17:02Z,3571775,,1080.0
JEnDcYxmD3M,Sulwhasoo you still got me burning 🔥,Song U got me burning by Swanky Tunes on the #shorts music Face still burning just took a Benadryl From this product ...,Jen S a Cocooned Butterfly,2021-04-17T13:12:46Z,355,5.0,3.0
xAoUszg6Pqk,Face oil doesn&#39;t hydrate your skin!,"Lots of people told me they use oil in their skincare routines for their dry or dehydrated skin, but friends—oil doesn't hydrate your ...",Mixed Makeup,2022-10-27T13:00:38Z,35228,871.0,76.0
rxLSubOnByY,"Hydrated, youthful-looking skin in every drop  #sulwhasoo #skinbarrier #glassskin","Designed to be the first step post-cleansing, our First Care Activating Serum's lightweight formula absorbs instantly to replenish ...",Sulwhasoo US,2023-09-14T16:00:41Z,386,10.0,0.0
wPuchnoP-UQ,Build your luxe skincare ritual with Sulwhasoo  #skinbarrier #antiagingeyecream #sulwhasoo,Build your luxe skincare ritual with Sulwhasoo and enjoy a beautiful amber pouch and skincare deluxes with any $250+ purchase!,Sulwhasoo US,2023-10-02T16:20:09Z,2926,40.0,0.0
7gS-l6FZxe4,Is The Sulwhasoo First Care Activating Serum Really Worth The Price? | Shopee TV,Should you splurge on the Sulwhasoo First Care Activating Serum? Find out from our Sulwhasoo review what we feel about this ...,Shopee Singapore,2021-03-31T16:00:09Z,5612,15.0,0.0
um-1pikltak,Every Drop Counts: Achieve Glass Skin with Sulwhasoo #HealthandWellness#NutritionTips,"Welcome to our channel! In this video, we will be diving into the world of skincare and uncovering the magical effects of ...",Fit Well Wise,2023-11-23T04:30:30Z,24,0.0,0.0
sJ2EqXO9-4s,Cleansing oil that removes waterproof makeup #sulwhasoo #kbeauty #skincare,I've been looking for a cleanser that can remove all makeup in one go for some time (yes I'm aware special eye and lip removers ...,Mad Like Dasha,2024-06-12T03:11:49Z,2495,45.0,3.0
HfMHWM4xE8o,Glowing Skin Guide,Step by Step Sulwhasoo Beauty Ritual.,Sulwhasoo US,2022-01-24T19:40:11Z,1016,21.0,0.0
NbLUNzUe4E8,Sephora Faves (Part 2) #shorts,Sephora Sale is Live: https://shopmyshelf.us/collections/24401.,Doctorly,2021-11-10T14:00:07Z,2230417,55170.0,286.0
3iUS7ZuOeSs,Sulwhasoo Concentrated Ginseng Renewing Eye Cream | Boniik #shorts,"Made with Ginsenomics and Ginseng Retinol, this luxurious eye cream from SULWHASOO brightens dark circles and smoothes ...",BONIIK,2022-11-20T07:00:03Z,4808,42.0,0.0
qdhnf6PO-BU,Sulwhasoo | ROSÉ in the HOUSE OF SULWHASOO,"From First Care Activating Serum to Concentrated Ginseng Skin Care, Rosé embraces the cozy night with her beloved essentials ...",Sulwhasoo US,2023-04-13T04:00:18Z,5927,292.0,25.0
qoXs9DPVq2c,Always start with the best after cleansing:  #skinbarrier #Koreanskincare,"our cult- favorite First Care Activating Serum VI hydrates, addresses visible signs of aging and helps boost the absorption of ...",Sulwhasoo US,2023-09-03T04:00:19Z,427,16.0,0.0
qoXs9DPVq2c,Always start with the best after cleansing:  #skinbarrier #Koreanskincare,"our cult- favorite First Care Activating Serum VI hydrates, addresses visible signs of aging and helps boost the absorption of ...",Sulwhasoo US,2023-09-03T04:00:19Z,427,16.0,0.0
H7Ys_8wCBOk,"Glow Anytime, Anywhere! Our First Care Activating Serum VI is now available in a 30mL size ✨","Meet your new travel-friendly skincare essential—powered by the healing strength of ginseng, this cult-favorite formula visibly ...",Sulwhasoo US,2025-04-24T04:00:16Z,501,5.0,0.0
fkdCh3mbnj8,Products that saved my skin barrier #shorts,,Sarah Palmyra,2022-08-29T18:41:59Z,6641419,192545.0,669.0
fkdCh3mbnj8,Products that saved my skin barrier #shorts,,Sarah Palmyra,2022-08-29T18:41:59Z,6641419,192545.0,669.0
uOXH9ZB4_Bs,Sulwhasoo | ROSÉ and Sulwhasoo,,Sulwhasoo US,2023-03-24T18:53:34Z,2806,201.0,5.0
O-ismSHnWYw,Sulwhasoo Skin Care Review 有中文字幕,"In this episode, Steve reviews Sulwhasoo skin care from Korea. Included in this review is Steve's trip to the Sulwhasoo skin care ...",Steve Jan,2017-04-05T19:00:01Z,113606,1410.0,169.0
EEcZHzMtugQ,5 at-home skincare tips to really improve your skin! | MY BEST SKIN EVER!,Get my Ultimate Glow Box here (Free Global Shipping + 45% OFF!) : https://rstyle.me/+7P2Mtr4y0d8J8gBCbRKgqwJust in case ...,Soo Beauty 수뷰티 ,2022-01-16T13:54:51Z,3930598,85521.0,1705.0
cMvaqdyzaCw,Sulwhasoo Ginseng Renewing Cream Soft,SKENC Korean's premium skincare line SK E&C store : https://skencos.com/ ebay : https://www.ebay.com/str/skencos insta ...,SK E&C (skenc),2023-05-25T09:48:06Z,263,5.0,0.0
anQfK3_6VBw,Which #kbeauty product is your winner? 🥊 #sulwhasoo #isntree #beautyhack #skincaretip,,Lisa Beautify,2023-09-13T16:07:51Z,17483,309.0,0.0
A29gy1EyGqE,K Beauty Top 5 Sulwhasoo Products To Buy| Skin Care,sulwhasoo #kbeauty #skincare Top 5 Sulwhasoo Products.,The Puja Talwar Show,2022-07-15T11:42:08Z,1338,18.0,1.0
Ww9I6MEXmh8,"Spring glow, unlocked!✨ Our Limited Edition sets have arrived #koreanskincare #giftsets #glassskin","Designed to boost, brighten, and visibly reduce fine lines for your most radiant skin yet: Concentrated Ginseng Rejuvenating ...",Sulwhasoo US,2025-04-02T00:00:33Z,569,8.0,0.0
t68LmUe4oX0,SulwhasooㅣTHE ULTIMATE S CREAM (진설크림)ㅣFROM 1966,NEW 설화수 진설크림 The Ultimate S cream Unveiling on 2023.09.01 1966년 최초의 인삼크림*인 ABC인삼크림의 디자인 모티브가 ...,Sulwhasoo,2023-08-31T15:05:55Z,1514,136.0,1.0
t68LmUe4oX0,SulwhasooㅣTHE ULTIMATE S CREAM (진설크림)ㅣFROM 1966,NEW 설화수 진설크림 The Ultimate S cream Unveiling on 2023.09.01 1966년 최초의 인삼크림*인 ABC인삼크림의 디자인 모티브가 ...,Sulwhasoo,2023-08-31T15:05:55Z,1514,136.0,1.0
PA8oEX2KrY4,I bought a popular $185 “miracle” japanese facial essence and here’s my thoughts 🫣 #skincare,product: https://myshlf.us/p-536930.,Shannon B. Stevens,2022-07-21T01:35:09Z,113830,2947.0,46.0
XC-Y9gYc9I8,The most beautiful K-beauty store in Seoul - Sulwhasoo Flagship Store❤️,The moment you walk in you'll be like whoa~! Highly recommend stopping by Sulwhasoo's flagship store in Dosan if you guys ...,EuniUnni,2023-04-19T02:00:09Z,7246,381.0,20.0
XWuZqbpZgE4,Sulwhasoo First Care Activating Serum | Beauty Tip 6,"The tell-tale signs from late nights can be hard to conceal, even with makeup on. Amplify the revitalising effects of the First Care ...",Sulwhasoo Singapore,2020-09-15T04:00:03Z,368,3.0,0.0
T4hme_kaTKA,how to correctly use cleansing oil and my fav cleansing oil from skin1004! #doublecleansing #kbeauty,,jenny,2025-03-16T11:31:11Z,203964,6860.0,48.0
T4hme_kaTKA,how to correctly use cleansing oil and my fav cleansing oil from skin1004! #doublecleansing #kbeauty,,jenny,2025-03-16T11:31:11Z,203964,6860.0,48.0
UhwMarhIYWE,Before &amp; After: Timetreasure Radiance Serum Cushion,Ingin mengetahui hasil akhir penggunaan Timetreasure Radiance Serum Cushion? Simak video ini dan rasakan kulit tetap ...,Sulwhasoo Indonesia,2022-01-04T05:00:20Z,2267,74.0,0.0
cyyydSbBZtA,Sulwhasoo first care activating perfecting water and emulsion,,Екатерина Gyou.cosmetics,2023-07-03T17:32:12Z,300,9.0,0.0
N2Al8OldBgg,Protect and transform your skin,"with Timetreasure Invigorating Serum, a luxe anti-aging serum and Timetreasure Invigorating Cream, a day-and-nighttime ...",Sulwhasoo US,2023-06-04T04:00:13Z,2783,46.0,0.0
PybCjHBmq9U,Sulwhasoo Night at The Met | Discover Rosé’s moments at The Metropolitan Museum of Art,雪花秀全球品牌代言人ROSÉ，於紐約大都會藝術博物館度過難忘的晚上，一起回味宴會的每個時刻。 #SulwhasooXTheMet ...,Sulwhasoo.HongKong,2023-04-28T09:26:04Z,370,23.0,0.0
T4hme_kaTKA,how to correctly use cleansing oil and my fav cleansing oil from skin1004! #doublecleansing #kbeauty,,jenny,2025-03-16T11:31:11Z,203964,6860.0,48.0
T4hme_kaTKA,how to correctly use cleansing oil and my fav cleansing oil from skin1004! #doublecleansing #kbeauty,,jenny,2025-03-16T11:31:11Z,203964,6860.0,48.0
8tnMicMngXQ,This skincare ingredient gave me an allergic reaction #shorts,If you wanna try the Great Body Relief I bought it here: https://go.shopmy.us/p-13531299.,Glow By Ramón,2023-05-16T20:51:19Z,985256,18224.0,329.0
t68LmUe4oX0,SulwhasooㅣTHE ULTIMATE S CREAM (진설크림)ㅣFROM 1966,NEW 설화수 진설크림 The Ultimate S cream Unveiling on 2023.09.01 1966년 최초의 인삼크림*인 ABC인삼크림의 디자인 모티브가 ...,Sulwhasoo,2023-08-31T15:05:55Z,1514,136.0,1.0
t68LmUe4oX0,SulwhasooㅣTHE ULTIMATE S CREAM (진설크림)ㅣFROM 1966,NEW 설화수 진설크림 The Ultimate S cream Unveiling on 2023.09.01 1966년 최초의 인삼크림*인 ABC인삼크림의 디자인 모티브가 ...,Sulwhasoo,2023-08-31T15:05:55Z,1514,136.0,1.0
Rb9M2xSTu2k,I am obsessed with FCAS from Sulwahsoo| First Care Activating Serum #kbeauty#luxe#luxury#skin#korean,,Lashita Dhingra,2023-09-04T06:21:06Z,161,9.0,0.0
Rixw-oDk_p0,Sulwhasoo | Concentrated Ginseng Renewing Serum EX (자음생세럼),"REJUVENATING POWERS OF GINSENG, ENCAPSULATED Sulwhasoo Concentrated Ginseng Renewing Serum EX Visit our ...",Sulwhasoo Indonesia,2022-10-05T07:08:49Z,17662,110.0,0.0
9AQuvBBO8eY,How to make glowing skin using a cushion foundation✨ #shorts,product: jsm skin nuder cushion & dearmydew hyaluronic acid serum.,krystallee,2024-10-17T01:33:00Z,98272,6139.0,41.0
J6RPItaHI6Q,Sulwhasoo First Care Activating Serum | Beauty Tip 7,"Showers can be a time of blissful recovery, especially with the First Care Activating Serum. Breathe in its scent to clear your mind ...",Sulwhasoo Singapore,2020-09-15T06:00:03Z,171,0.0,0.0
43eC9HuHQNU,Grwm🩶 #makeup #kbeauty #armanibeauty #sulwhasoo #shiseido #rarebeauty #tomford #innisfree #nars,,Estefania,2023-08-30T07:27:07Z,106,13.0,8.0
8Y1WH2Qm6Bo,Korean Skincare Favourites when my skin is breaking by out || Dr.Riya || #skincare,,Dr Riya,2023-11-24T14:47:42Z,6912949,190363.0,776.0
fkdCh3mbnj8,Products that saved my skin barrier #shorts,,Sarah Palmyra,2022-08-29T18:41:59Z,6641419,192545.0,669.0
fkdCh3mbnj8,Products that saved my skin barrier #shorts,,Sarah Palmyra,2022-08-29T18:41:59Z,6641419,192545.0,669.0
qoXs9DPVq2c,Always start with the best after cleansing:  #skinbarrier #Koreanskincare,"our cult- favorite First Care Activating Serum VI hydrates, addresses visible signs of aging and helps boost the absorption of ...",Sulwhasoo US,2023-09-03T04:00:19Z,427,16.0,0.0
qoXs9DPVq2c,Always start with the best after cleansing:  #skinbarrier #Koreanskincare,"our cult- favorite First Care Activating Serum VI hydrates, addresses visible signs of aging and helps boost the absorption of ...",Sulwhasoo US,2023-09-03T04:00:19Z,427,16.0,0.0
Oarqsa1kbG4,Products That Didn’t Work For Me &amp; The Ones That Did,"Have you tried any of these? Did you have a different/similar experience? Let me know in the comments. If you liked this video, ...",Tarini Peshawaria,2022-09-08T04:36:55Z,2475516,75192.0,361.0
2nqDUyp6CIA,Sulwhasoo Masks Review | Purifying Clay and Radiance Refining Mask #koreanskincare #kbeautyskincare,This is my review of the Sulwhasoo Masks: ⭐️ Purifying Clay Mask ⭐️ Radiance Refining Mask Each of these masks offers a ...,It's Thy Time,2023-05-09T15:00:05Z,747,10.0,0.0
MjzFRBZRdxE,Celebrity Diane Medina&#39;s Secret to Looking Fresh is No Other Than Dewha ✨,dewha #dewhaskin #beautytips #skincare #skincareph #makeup #antiaging #skinaging #sheetmask #antiagingserum #serum.,Dewha,2023-12-04T14:51:39Z,125,2.0,0.0
x4TVxpuWxgc,50만원짜리 설화수 크림 발라보기 #설화수 #sulwhasoo #설화수팝업스토어,"잠실 롯데월드몰 지하1층에서 진행 중인 설화수 팝업스토어 핫한 모델 로제와 함께 하는 새로워진 진설 크림을 만나볼 수 있는데요, ...",서부핫탐,2023-10-21T01:24:17Z,984,11.0,0.0
Kj6MPlsTvwo,Sulwhasoo | Tilda Swinton and Sulwhaoo,,Sulwhasoo US,2023-03-24T18:42:02Z,2112,60.0,0.0
5Y5SbF76L5Y,Sulwhasoo x Teacher Kevin | Firming Synergy Duo (English Subtitles),"Firm, lift and nourish your complexion back to its most youthful state with holistic beauty. Acclaimed makeup artist, Teacher Kevin, ...",Sulwhasoo Singapore,2020-12-31T11:00:02Z,374,2.0,0.0
Evdxhw9fCkY,How to reduce the appearance of your PORES~ ✨,I feel like most of us are usually looking for something that will help with our ✨pores✨ so here are some of my tips and product ...,Tina Tanaka Harris,2022-05-13T05:08:36Z,3498080,102437.0,968.0
11EWt3mXo_Y,Moroccanoil Night Body Serum Before &amp; After,Welcome to autumn! Transitioning your skin to add extra hydration will help fight off any dryness that might be coming our way.,Moroccanoil,2023-10-06T15:01:12Z,2543,86.0,0.0
sc43ImettjE,Rosé🖤 at the Sulwhasoo event arrival#blackpink#blink#blinks#rosé#jennie#lisa#jisoo#sulwhasoo#me#kpop,,BLACKPINK in your area,2023-03-30T19:37:11Z,31,6.0,3.0
TSsHlCX46T4,FINALLY trying this highly requested sunscreen 🤎,,Monica Ravichandran,2023-06-04T02:13:37Z,2878695,95601.0,427.0
cKmaZTotN6A,Sulwhasoo Essential Comfort Balancing Set Unboxing I Korean Skincare #shorts,What's your favourite product from the Sulwhasoo Essential Comfort Balancing Set? #koreanskincare #Sulwhasoo ...,lifestyle by k.a.,2022-09-02T17:11:26Z,1381,19.0,1.0
K4baa0wrSTg,I AM GINSENG - Obsession,"While ginseng has been commonly regarded as a root useful for its health benefits, to Sulwhasoo it has held a sacred significance ...",Sulwhasoo Indonesia,2023-06-13T01:53:41Z,224,6.0,1.0
n7eosOYEWmA,SulwhasooㅣTHE ULTIMATE S CREAM (진설크림)ㅣTHE MOON JAR,NEW 설화수 진설크림 The All-New Ultimate S Unveiling on 2023.09.01 보름달의 풍요로움과 소생의 의미를 품은 달항아리.,Sulwhasoo,2023-08-31T15:05:51Z,1688,85.0,1.0
PIMg8gV7j3M,Sulwhasoo First Care Activating Serum | Beauty Tip 3,"With skin much thinner in our neck area, the tell-tale signs of time usually emerge much earlier even before they do on the face.",Sulwhasoo Singapore,2020-09-14T10:00:05Z,92,0.0,0.0
pwsKs0rzAeM,Blackpink Rose as Sulwhasoo Global Ambassador #blackpink #rose #kpop #idol #shorts #viral,Disclaimer: I don't own anything. Song and information belong to SULWHASOO and ROSE of blackpink. This video is for learning ...,Muzic Kraze,2023-04-11T05:10:53Z,1491,61.0,1.0
Ub1_H7aFJu4,MOST BLURRING SETTING POWDERS EVER!,MENTIONED Huda Beauty Easy Bake Loose Setting Powder https://go.magik.ly/ml/1l3bo/ Maybelline Fit Me Loose Finishing ...,Morgan Turner,2023-05-28T15:30:07Z,641081,21114.0,152.0
8Wg4A9bQXvo,"Sulwhasoo Flagship Tour, getting legally married, pop&#39;n hubby&#39;s pimple &amp; more😝",Hi guys! Taking u guys to a quick tour around SULWHASOO flagship store plus Derek & I got finally legally married haha:D Hope ...,EuniUnni,2021-09-06T13:00:11Z,21541,722.0,102.0
h3eAqKP7BMo,Check out Sulwhasoo: Rebirth of Ginseng pop-up at Ion Orchard this weekend,Calling all skincare enthusiasts and ginseng lovers: head down to Ion Orchard for an extraordinary journey through the 60-year ...,Tatler Singapore,2024-09-22T01:00:31Z,52,2.0,
oLTedwhNrJ4,Sulwhasoo | How-to: Timetreasure Radiance Serum Cushion,Begin your journey to ageless beauty with the Timetreasure Radiance Serum Cushion. Indulge in impeccable perfection and be ...,Sulwhasoo Singapore,2021-03-20T10:30:09Z,2127,9.0,0.0
1QqP4IRP0Xg,Sulwhasoo | Tilda Swinton and Sulwhaoo,,Sulwhasoo US,2023-03-24T18:44:06Z,3023,71.0,2.0
0f3Pn3elUMk,TIMETREASURE CUSHION MAKEUP,,Sulwhasoo Thailand Official,2021-04-16T09:08:34Z,549,13.0,0.0
vjtObsXIpk4,Sulwhasoo | First Care Activating Serum VIㅣFIRST PEACE,Feel the unique comfort and relaxation that only First Care Activating Serum VI can provide. ONE PRESS TO PEACE Sulwhasoo ...,Sulwhasoo US,2023-03-24T16:39:20Z,710,3.0,0.0
XPEs8ggKtGQ,✨6 BENEFITS IN ONE BOTTLE?!!?✨ Sulwhasoo First Care Activating Serum First Impressions (Ipsy),Hey friends!! Welcome back to our channel! Today we have a new skincare first impressions/review. This is the Sulwhasoo First ...,Everyday Thrifty Living,2022-11-07T17:00:18Z,59,7.0,6.0
O1wjq3XZky4,*Product Empties*😍will 100% repurchase#skincare#product#empties#serum#brownskin,Skincare Empties I love and will repurchase over and over @sulwhasoo.india First care Activating serum @theordinary Soothing ...,The Mystic Girl,2024-07-31T07:06:40Z,892,25.0,2.0
_sSkSbmeZlA,First Care Activating Serum VIㅣHide &amp; Seek,"Now revealed: ROSÉ's favorite serum for hydrated, youthful-looking skin. Available @sephora, @amazon, and us.sulwhasoo.com.",Sulwhasoo US,2023-09-08T15:02:18Z,656086,6.0,0.0
yI98sCfAO2o,Why my mother-in-law has AMAZING SKIN✨ #shorts,Instagram: https://www.instagram.com/euniunni/ TikTok: https://www.tiktok.com/@euniunni Derek got it from his mama!,EuniUnni,2022-08-03T11:00:29Z,14577,952.0,12.0
QjCFTdtdizA,Mum&#39;s lifted her skincare game! 🎧 Listen to Beauty IQ Expert wherever you get your podcasts,,Adore Beauty,2025-03-03T22:31:08Z,3648,136.0,3.0
McZYEW-Tc0M,Current day time beauty favorites #aestheticvideo #beautytips #beautyproducts #dayinthelife,Day time favorites - Sulwhasoo Ginseng concentrate serum Elemis Pro collagen cleansing balm ThreeShips Harmony cleanser ...,Kat Jin,2023-05-06T00:47:37Z,1330,37.0,0.0
WGktUDWivYM,#blackpink #rose#sulwhasoo Can&#39;t take my eyes off of the beautiful Australian rose 💖,,Luong Nguyen,2023-04-01T13:10:08Z,1359,35.0,0.0
m0EhwBv6SPc,"Our best-selling, radiance-activating serum is the perfect multi-tasker.","Use this serum for makeup prep, or mix in with your foundation for hydration and a more radiant coverage.",Sulwhasoo US,2023-01-20T05:00:16Z,955,17.0,0.0
eC7QAFTCyWs,Preparing  Your Skin Before Makeup is soooo Important❣️ Prep it Using The Dewha&#39;s Mini Glow Trio 💖,dewha #dewhaskin #beautytips #skincare #skincareph #makeup #antiaging #skinaging #sheetmask #antiagingserum #serum.,Dewha,2023-10-04T01:47:16Z,78,1.0,0.0
OVlUxP6sMZQ,Sulwhasoo | ROSÉ and Sulwhasoo |,,Sulwhasoo US,2023-03-24T18:50:43Z,2916,183.0,5.0
C-dDuQ1dRqo,Blackpink Rose 🌹 AT Sulwhasoo #shorts #youtubeshorts,Blackpink Rose At Sulwhasoo launching Event #blackpinkrose #sulwhasoo #launch #youtubeshorts #youtube #opening ...,Infotainment 🤗,2023-09-04T18:44:21Z,2217,98.0,3.0
nRqkXePQmXY,Sulwhasoo | ROSÉ and Sulwhasoo,,Sulwhasoo US,2023-03-24T18:55:36Z,6401,442.0,69.0
IaqCopGNWDE,Watch Before Buying Honest Review Sulwhasoo Face Serum,Amazon link: https://amzn.to/3Fl7PO7.,Mariel Moheyeldien,2025-05-30T08:03:23Z,13,0.0,0.0
t81Ff-KLlEc,Gifts for your best glow 🎁✨,"Receive a 4-piece Daily Comfort Routine with $175+ purchase! Us.Sulwhasoo.com *Offer valid until June 16, 2023 at 11:59pm ...",Sulwhasoo US,2023-06-07T18:04:47Z,474,9.0,0.0
sTEKplRCNho,Wait before applying sunscreen #dermatologist @DrDrayzday,skincaretips #skincareadvice #skincareroutine #skincareroutines #sunscreen.,Dr Dray,2022-12-21T00:00:28Z,129924,5974.0,166.0
cWgut2CGbcQ,Adress visible signs of aging with our powerful Concentrated Ginseng Renewing Serum,"Featuring thousands of Ginsenomics Capsules™ that dissolve immediately onto skin to help visibly improve wrinkles, promote a ...",Sulwhasoo US,2023-02-14T05:00:30Z,1466,13.0,0.0
CBKRIHguUrA,My Hot Takes on Viral Korean Face Masks✨ #skincare,"7 Days of Korean Skincare | DAY ONE Tried & Tested: Viral Korean Face Masks—some hits, some major misses. Here's the tea: 1 ...",Samapti Banerjee,2025-05-02T12:37:18Z,30161,407.0,3.0
R38mLJ6ydoM,ROSE IN SULWHASOO EVENT #sulwhasoo #rose #blink #blackpink,,Jessica and Genis,2023-09-04T15:01:46Z,131,7.0,0.0
_xTBvkTEMBg,I AM GINSENG - Research,"Sulwhasoo's pursuit of ginseng research led to its continuous evolution and advancement throughout generations, unlocking its ...",Sulwhasoo Indonesia,2023-06-13T01:55:47Z,181,5.0,0.0
3Cb-r6hJi5I,Be always on the go with Dewha&#39;s Miracle Glow Duo just like Yassi Pressman!,Shop here: bit.ly/3YRK5Wn Facebook: https://www.facebook.com/dewhaskin Instagram: https://www.instagram.com/dewha.co/ ...,Dewha,2023-02-22T05:44:34Z,644,4.0,0.0
rkXzCeY3YvI,SNP PREP Cicaronic SOS Ampoule,Repost @wendyw.deng • • • • • • #MaskMonday with Skencos Sheet Masks & Sulwhasoo Overnight Vitalizing Mask . How's ...,SK E&C (skenc),2023-01-31T14:24:55Z,1093,17.0,0.0
m33-IiSDGzM,🏆 My Skincare Top 10 🏆 #shorts,Why did this take me days to narrow down ⁣⁣ ⁣#Sulwhasoo First Care Activating Serum ⁣#Somebymi AHA BHA PHA Miracle ...,Annie Wang Tamaki,2024-03-01T15:00:50Z,5341,119.0,4.0
k5ycKEnhl7w,Rose at sulwhasoo x the met event #Rose #blackpink #blink,,blink unnie,2023-07-02T08:07:08Z,341,16.0,1.0
R_2L4X3qILU,"Sản phẩm phục hồi cực đỉnh, serum nhân sâm Sulwhasoo #reviewmypham #duongda #lamdep",,Lucia ,2023-10-24T11:35:04Z,7511,198.0,35.0
LHMpHRJo5Xw,Rosé IG Update 🥰 Rosé X Sulwhasoo X THE MET 🥰 #rosé,,farhana,2023-03-30T18:12:26Z,2280,313.0,8.0
