video_id,title,description,channel,published,views,likes,comments
n-z9nb6xCoo,SULWHASOO ANTI AGING || REVIEW JUJUR || 20 HARI PEMAKAIAN,Review jujur sulwhasoo anti aging harga 250.000 (dalam rupiah) beli di https://shopee.co.id/femaledailyskincare Instagram: ...,Indah Chyntia,2018-05-25T19:07:49Z,20606,99.0,37.0
n-z9nb6xCoo,SULWHASOO ANTI AGING || REVIEW JUJUR || 20 HARI PEMAKAIAN,Review jujur sulwhasoo anti aging harga 250.000 (dalam rupiah) beli di https://shopee.co.id/femaledailyskincare Instagram: ...,Indah Chyntia,2018-05-25T19:07:49Z,20606,99.0,37.0
RdHZV3ncGM4,I do NOT recommend these products... heh,Come hang out with me on instagram as well for more skincare tips & recs! https://www.instagram.com/_soobeauty/ ✔️I ...,Soo Beauty 수뷰티 ,2022-09-16T12:00:27Z,682981,3808.0,314.0
RdHZV3ncGM4,I do NOT recommend these products... heh,Come hang out with me on instagram as well for more skincare tips & recs! https://www.instagram.com/_soobeauty/ ✔️I ...,Soo Beauty 수뷰티 ,2022-09-16T12:00:27Z,682981,3808.0,314.0
buDbz4qi5E8,Sulwhasoo Skincare Challenge: Sarah Sofyan x Wenny Dewanti,"Terinsprasi dari beauty regime perempuan di Korea Selatan, ada 3 tahap prinsipil yang harus dipatuhi untuk melindungi dan ...",Sulwhasoo Indonesia,2018-09-19T10:55:49Z,7407,9.0,0.0
buDbz4qi5E8,Sulwhasoo Skincare Challenge: Sarah Sofyan x Wenny Dewanti,"Terinsprasi dari beauty regime perempuan di Korea Selatan, ada 3 tahap prinsipil yang harus dipatuhi untuk melindungi dan ...",Sulwhasoo Indonesia,2018-09-19T10:55:49Z,7407,9.0,0.0
8Y1WH2Qm6Bo,Korean Skincare Favourites when my skin is breaking by out || Dr.Riya || #skincare,,Dr Riya,2023-11-24T14:47:42Z,6912949,190363.0,776.0
iCT1fdXjr78,Best and Worst Sunscreens,"Not all sunscreens are created equal, and we all know how tricky it can be to find the perfect one! Here's my take on some of ...",Dr Shailya Gupta MD,2024-12-17T08:53:05Z,1998861,26293.0,242.0
n-z9nb6xCoo,SULWHASOO ANTI AGING || REVIEW JUJUR || 20 HARI PEMAKAIAN,Review jujur sulwhasoo anti aging harga 250.000 (dalam rupiah) beli di https://shopee.co.id/femaledailyskincare Instagram: ...,Indah Chyntia,2018-05-25T19:07:49Z,20606,99.0,37.0
n-z9nb6xCoo,SULWHASOO ANTI AGING || REVIEW JUJUR || 20 HARI PEMAKAIAN,Review jujur sulwhasoo anti aging harga 250.000 (dalam rupiah) beli di https://shopee.co.id/femaledailyskincare Instagram: ...,Indah Chyntia,2018-05-25T19:07:49Z,20606,99.0,37.0
N5ulNRWji3I,Review jujur serum sultan 😱 || Sulwhasoo First Care Activating Serum,Link pembelian Sulwashoo 60ml: https://shope.ee/3V9wu2aMyX Kit 5 item: https://shope.ee/2KxzW0TWm8 Buy 1 get 1: ...,Hertin Badriah,2022-10-25T17:02:52Z,218,8.0,2.0
N5ulNRWji3I,Review jujur serum sultan 😱 || Sulwhasoo First Care Activating Serum,Link pembelian Sulwashoo 60ml: https://shope.ee/3V9wu2aMyX Kit 5 item: https://shope.ee/2KxzW0TWm8 Buy 1 get 1: ...,Hertin Badriah,2022-10-25T17:02:52Z,218,8.0,2.0
RdHZV3ncGM4,I do NOT recommend these products... heh,Come hang out with me on instagram as well for more skincare tips & recs! https://www.instagram.com/_soobeauty/ ✔️I ...,Soo Beauty 수뷰티 ,2022-09-16T12:00:27Z,682981,3808.0,314.0
RdHZV3ncGM4,I do NOT recommend these products... heh,Come hang out with me on instagram as well for more skincare tips & recs! https://www.instagram.com/_soobeauty/ ✔️I ...,Soo Beauty 수뷰티 ,2022-09-16T12:00:27Z,682981,3808.0,314.0
buDbz4qi5E8,Sulwhasoo Skincare Challenge: Sarah Sofyan x Wenny Dewanti,"Terinsprasi dari beauty regime perempuan di Korea Selatan, ada 3 tahap prinsipil yang harus dipatuhi untuk melindungi dan ...",Sulwhasoo Indonesia,2018-09-19T10:55:49Z,7407,9.0,0.0
buDbz4qi5E8,Sulwhasoo Skincare Challenge: Sarah Sofyan x Wenny Dewanti,"Terinsprasi dari beauty regime perempuan di Korea Selatan, ada 3 tahap prinsipil yang harus dipatuhi untuk melindungi dan ...",Sulwhasoo Indonesia,2018-09-19T10:55:49Z,7407,9.0,0.0
YQaE3QMnayM,6 Steps Korean Skincare Routine Sulwashoo #shorts #Korean Skincare,,tbHome,2022-04-23T20:36:40Z,503,17.0,0.0
gy7pxYn_lno,Sulwhasoo Evenfair Perfecting Cushion REVIEW,Hi loves!! I hope you're enjoying your summer! What's really important when you're enjoying your time in this hot hot sunny ...,EmJustLikeYou,2014-07-26T19:01:23Z,49886,316.0,37.0
kis1-MspAlE,Achieved that Korean Glass Skin with DEWHA Perfect Glow CC Cushion. A make up and skincare in one. 💗,dewha #dewhaskin #makeup #ytshorts.,Dewha,2023-04-12T06:19:03Z,4596,29.0,2.0
8tnMicMngXQ,This skincare ingredient gave me an allergic reaction #shorts,If you wanna try the Great Body Relief I bought it here: https://go.shopmy.us/p-13531299.,Glow By Ramón,2023-05-16T20:51:19Z,985253,18224.0,329.0
cQJ496O73aQ,3 expensive skincare products I’ll repurchase #skincare #aesthetician #acneproneskin,,Dr.Bhagyashree,2023-06-11T17:34:35Z,5887108,192030.0,1086.0
3LYOjo8jCi8,Must Try Hacks|| Is your foundation too warm? || Sulwhasoo to the rescue!,I got this great foundation from Rimmel because it was fragrance free. The color was almost a perfect match but it was too warm.,Jacklyn of all trades,2017-02-08T16:51:25Z,333,3.0,0.0
AVm2FKLIO5E,Sulwhasoo Perfecting Cushion Broad Spectrum SPF 50+ Sunscreen Wear Test | Tiana Le,"Hi Everyone, In this video I'm doing a wear test on the Sulwhasoo Perfecting Cushion Broad Spectrum SPF 50+ Sunscreen . xo, ...",tbHome,2021-03-27T18:42:16Z,10618,56.0,9.0
fkdCh3mbnj8,Products that saved my skin barrier #shorts,,Sarah Palmyra,2022-08-29T18:41:59Z,6641421,192545.0,669.0
ZbHwfvfKyiY,"October Skincare &amp; Beauty Favourites | Sulwhasoo, Becca, Viseart, Missha || TrishhYoungg",ALL YOUR QUESTIONS ANSWERED *CLICK HERE* #MonthlyFavourites October 2016 Skincare + Beauty Favourites All things ...,Tricia Young,2016-11-07T01:49:05Z,552,26.0,15.0
46r3Y2hcFh0,Sulwhasoo Gentle Cleansing Oil,Sulwhasoo Gentle Cleansing Oil is a skincare product designed to effectively remove waterproof makeup and SPF while ...,amazon Gadgets,2023-02-26T06:00:09Z,462,2.0,0.0
T4hme_kaTKA,how to correctly use cleansing oil and my fav cleansing oil from skin1004! #doublecleansing #kbeauty,,jenny,2025-03-16T11:31:11Z,203964,6860.0,48.0
FFuOU3lGnj4,Full Face of Sulwhasoo,Products Mentioned: Find the brand here: https://go.magik.ly/ml/nn4o/ --------------------------------- What I'm wearing: Prep: ...,Melinda Joy,2019-06-17T16:00:03Z,2918,21.0,5.0
PA8oEX2KrY4,I bought a popular $185 “miracle” japanese facial essence and here’s my thoughts 🫣 #skincare,product: https://myshlf.us/p-536930.,Shannon B. Stevens,2022-07-21T01:35:09Z,113830,2947.0,46.0
1Qjil5m35JU,SULWHASOO 2020 Spring Collection/LIMITED EDITION/Perfecting Cushion/Dry-Skin 8 Hour Wear Test,Sulwhasoogiftedme #OctolyFamily #KBeauty Thank you so much for joining me today as I do an 8+ hour wear test and review of ...,PerkiPerkins,2020-04-22T23:42:49Z,4035,103.0,73.0
0NyfygGzouU,Get a Healthy Glow with Sulwhasoo Signatures,Slow down the signs of time with the potent pairing of Concentrated Ginseng Renewing Serum and Cream. Harnessing the power ...,Sulwhasoo Indonesia,2020-11-02T06:12:30Z,90003,221.0,3.0
zxMejSEMRDU,Achieve That Instant Glowy Skin with Dewha&#39;s Miracle Glow Dou 💕,dewha #dewhaskin #beautytips #skincare #skincareph #makeup #antiaging #skinaging #sheetmask #antiagingserum #serum.,Dewha,2023-08-29T16:00:52Z,294,1.0,0.0
DdNwUtHtU3k,Sulwhasoo + Laneige BB Cushion | HONEST Review &amp; Demo,"Hey guys, here's a full review and close-up demo on Sulwhasoo Perfecting Cushion & Laneige BB Cushion! (WATCH IN HD) ...",Delilah's Delights,2015-11-26T03:43:47Z,67849,330.0,160.0
uchSItM5SKg,Sulwhasoo radiance blusher 10g,,Cosmetics Favorite,2020-04-08T15:57:36Z,305,3.0,0.0
e1ifrqiL1HY,Take your selfies to the next level after using Dewha&#39;s Amino Acid Gentle Cleansing Mousse! 🌸,dewha #dewhaskin #skincare #glowingskin #ytshorts.,Dewha,2023-03-20T06:04:55Z,108,2.0,0.0
z1F5y9MnA2w,Sulwhasoo BB Cushion &amp; Skincare Review,I've been loving these products whenever I get access to them at home in HK (my mom's stash) ...,littlemsamanda,2015-06-29T12:00:06Z,35953,102.0,13.0
XlEM3NEQLEA,Achieve Korean Glass Skin with These 4-Easy Steps 💖✨,dewha #dewhaskin #beautytips #skincare #skincareph #makeup #antiaging #skinaging #sheetmask #antiagingserum #serum ...,Dewha,2023-09-30T08:00:16Z,37,2.0,0.0
XGD6YDk4vK4,Hera vs Jung Saem Mool Cushion Foundation Review,,Jenny Moon,2025-03-27T15:58:40Z,40258,1440.0,18.0
tVg15zrsJJg,Sulwhasoo holiday gift set,,LuxUnwrap,2022-12-27T06:42:48Z,107,3.0,0.0
SB135ZHFcdU,Sulwhasoo Balance Spa,Check out my full review at: https://theadvisoryvault.com/f/sulwhasoo-spa---gangnam-south-korea This video was uploaded purely ...,Advisory Vault,2019-08-25T09:39:11Z,85,1.0,0.0
HGeiPtwlVlo,"Unboxing Korean Beauty Products ( Meibekorea, Sulwhasoo, Leegeehaam, Enature and more )","In today's video I will do an unboxing of products that I received this week, it includes mostly Korean Beauty Products but also ...",Sokobeauty,2018-03-04T19:29:49Z,555,33.0,31.0
2NHvj-N63QA,Experience the Dewha glow!,dewha #dewhaskin #makeup #beauty #ytshorts.,Dewha,2023-03-24T06:02:46Z,1541,21.0,0.0
lHjBh1V61Xw,Holidays are coming!  🎁 Miracle Dou is the Perfect Gift That you can Give to Your Favorite Girl 💖,dewha #dewhaskin #beautytips #skincare #skincareph #makeup #antiaging #skinaging #sheetmask #antiagingserum #serum ...,Dewha,2023-09-22T08:39:21Z,33,1.0,0.0
TSsHlCX46T4,FINALLY trying this highly requested sunscreen 🤎,,Monica Ravichandran,2023-06-04T02:13:37Z,2878736,95601.0,427.0
O0KAPEYRECI,Get that luminous glow and hydrated skin with Dewha&#39;s Flawless Glow Hydrating Primer! ✨,dewha #dewhaskin #glowingskin #skincare #makeup #ytshorts.,Dewha,2023-03-15T08:01:52Z,1373,16.0,0.0
5BY4W6YBZR8,"Sulwhasoo Perfecting Cushion Review! ♥ vs. Laneige, Hera, Iope XP | 설화수 퍼펙팅쿠션 리뷰! #TryItTuesday","Hey munchkin musers, Sorry this Try It Tuesday was a little late! I hope you all enjoy this detailed review of my current fave ...",meejmuse,2015-02-11T22:50:12Z,205958,2336.0,236.0
k9LZv2bcl68,99.9% real gold with your favorite Dewha serum!,dewha #dewhaskin #skincare #ytshorts.,Dewha,2023-03-15T08:11:43Z,407,9.0,0.0
67CM5dK-MS4,Sulwhasoo 50 Year Great Journey to Holistic Beauty,,Sulwhasoo US,2016-08-31T20:25:20Z,5848,32.0,0.0
vjM1vVWCnac,A CC Cushion with SPF 30! Glow and protect your skin at the same time ✨,dewha #dewhaskin #skincare #glowingskin #makeup #ytshorts.,Dewha,2023-03-22T03:36:21Z,255,6.0,0.0
XFQrrugrW5I,Honest Review MISSHA Magic Cushion Foundation No 23 #shorts #skincareproduct #skincareroutine,Honest Review MISSHA Magic Cushion Foundation No 23 #shorts #skincareproduct #skincareroutine https://amzn.to/4bPINSL ...,BeautyEveryday,2024-06-07T11:45:30Z,105,2.0,0.0
3T6liKvVEtk,Honest Review of Tizo Tinted Sunscreen #Shorts #makeup #sunscreen #sunprotection,Honest Review of Tizo Tinted Sunscreen #Shorts #makeup #sunscreen #sunprotection TiZO3 Facial Mineral Sunscreen and ...,BeautyEveryday,2024-06-05T14:29:44Z,162,1.0,0.0
IilmX79lYSs,Honest Review EltaMD UV Elements SPF 44 #Shorts #sunscreen #makeup #sunprotection #beauty,Honest Review EltaMD UV Elements SPF 44 #Shorts #sunscreen #makeup #sunprotection #beauty EltaMD UV AOX Elements ...,BeautyEveryday,2024-06-05T13:34:04Z,177,1.0,0.0
skxH970Vc1s,Mommy Karenn Casil Shares Her Updated Routine for A More Youthful and Glowing Skin 💖,dewha #dewhaskin #beautytips #skincare #skincareph #makeup #antiaging #skinaging #sheetmask #antiagingserum #serum.,Dewha,2023-11-16T09:41:21Z,80,3.0,4.0
skxH970Vc1s,Mommy Karenn Casil Shares Her Updated Routine for A More Youthful and Glowing Skin 💖,dewha #dewhaskin #beautytips #skincare #skincareph #makeup #antiaging #skinaging #sheetmask #antiagingserum #serum.,Dewha,2023-11-16T09:41:21Z,80,3.0,4.0
cU4_y9De41c,SULWHASOO ANGELIC MAKEUP | CUSHION PERFECTING EX HONEST REVIEW &amp; DEMO | Makeup Thiên Thần,Hãy cùng The Cloud biến hoá thành thiên sứ bằng kiểu Makeup làn da đẹp không tì vết nhé Các sản phẩm dùng trong clip: ...,The Cloud Beauty,2017-09-21T12:37:41Z,91953,1162.0,109.0
cU4_y9De41c,SULWHASOO ANGELIC MAKEUP | CUSHION PERFECTING EX HONEST REVIEW &amp; DEMO | Makeup Thiên Thần,Hãy cùng The Cloud biến hoá thành thiên sứ bằng kiểu Makeup làn da đẹp không tì vết nhé Các sản phẩm dùng trong clip: ...,The Cloud Beauty,2017-09-21T12:37:41Z,91953,1162.0,109.0
q_aN1xvBEs4,Best moisturizer I have ever tried!!! #ugc #skincare #skincareroutine #bubbleskincare,Wrinkle care / Rejuvanating / Moisturizing / Anti-aging / Intensive wrinkle improvement - Apply it evenly on dry areas to keep your ...,justKMT 💗,2023-10-06T15:51:05Z,1178,33.0,3.0
YXNjq6O6oyo,SULWHASOO PERFECTING CUSHION LIMITED 2016 | First Impression &amp; Review | The Cloud,SULWHASOO PERFECTING CUSHION LIMITED 2016 là cushion high-end của hãng mỹ phẩm Sulwhasoo từ tập đoàn Amore ...,The Cloud Beauty,2016-06-01T13:19:55Z,49976,448.0,
YXNjq6O6oyo,SULWHASOO PERFECTING CUSHION LIMITED 2016 | First Impression &amp; Review | The Cloud,SULWHASOO PERFECTING CUSHION LIMITED 2016 là cushion high-end của hãng mỹ phẩm Sulwhasoo từ tập đoàn Amore ...,The Cloud Beauty,2016-06-01T13:19:55Z,49976,448.0,
m33-IiSDGzM,🏆 My Skincare Top 10 🏆 #shorts,Why did this take me days to narrow down ⁣⁣ ⁣#Sulwhasoo First Care Activating Serum ⁣#Somebymi AHA BHA PHA Miracle ...,Annie Wang Tamaki,2024-03-01T15:00:50Z,5341,119.0,4.0
m33-IiSDGzM,🏆 My Skincare Top 10 🏆 #shorts,Why did this take me days to narrow down ⁣⁣ ⁣#Sulwhasoo First Care Activating Serum ⁣#Somebymi AHA BHA PHA Miracle ...,Annie Wang Tamaki,2024-03-01T15:00:50Z,5341,119.0,4.0
QWKEiJxM1KM,My Skincare routine during Lockdown | Glowing skin #laneige #sulwhasoo #pixitoner #nykaa,"Hey Guys,Welcome back to my channel!!Hope you all are doing good.. Today I am going to share products I use in my skincare ...",Amrita Kaur Saini,2020-08-25T05:49:33Z,800,24.0,24.0
QWKEiJxM1KM,My Skincare routine during Lockdown | Glowing skin #laneige #sulwhasoo #pixitoner #nykaa,"Hey Guys,Welcome back to my channel!!Hope you all are doing good.. Today I am going to share products I use in my skincare ...",Amrita Kaur Saini,2020-08-25T05:49:33Z,800,24.0,24.0
nygKe_nPCbk,Honest Review DearKlairs Midnight Blue Calming Cream #shorts #skincare #beauty #makeup #sunscreen,Honest Review DearKlairs Midnight Blue Calming Cream #shorts #skincare #beauty #makeup #sunscreen ...,BeautyEveryday,2024-06-07T11:23:12Z,17,4.0,0.0
nygKe_nPCbk,Honest Review DearKlairs Midnight Blue Calming Cream #shorts #skincare #beauty #makeup #sunscreen,Honest Review DearKlairs Midnight Blue Calming Cream #shorts #skincare #beauty #makeup #sunscreen ...,BeautyEveryday,2024-06-07T11:23:12Z,17,4.0,0.0
AirPIrlvbYs,AVEENO Restorative Skin Therapy REVIEW,"Hello, my name is Christina Harrison.   Take a moment and sit back, relax and let me take you into my world. Aveeno ...",Christina Harrison,2021-06-09T12:30:02Z,1126,11.0,30.0
3augmzh5iuY,Blend that perfect cc cushion into your skin to achieve that glowy natural look! ✨,dewha #dewhaskin #makeup #ytshorts.,Dewha,2023-04-03T05:28:31Z,211,1.0,0.0
3augmzh5iuY,Blend that perfect cc cushion into your skin to achieve that glowy natural look! ✨,dewha #dewhaskin #makeup #ytshorts.,Dewha,2023-04-03T05:28:31Z,211,1.0,0.0
cU4_y9De41c,SULWHASOO ANGELIC MAKEUP | CUSHION PERFECTING EX HONEST REVIEW &amp; DEMO | Makeup Thiên Thần,Hãy cùng The Cloud biến hoá thành thiên sứ bằng kiểu Makeup làn da đẹp không tì vết nhé Các sản phẩm dùng trong clip: ...,The Cloud Beauty,2017-09-21T12:37:41Z,91953,1162.0,109.0
cU4_y9De41c,SULWHASOO ANGELIC MAKEUP | CUSHION PERFECTING EX HONEST REVIEW &amp; DEMO | Makeup Thiên Thần,Hãy cùng The Cloud biến hoá thành thiên sứ bằng kiểu Makeup làn da đẹp không tì vết nhé Các sản phẩm dùng trong clip: ...,The Cloud Beauty,2017-09-21T12:37:41Z,91953,1162.0,109.0
NR2fEFow2qA,Sulwhasoo Perfecting Cushion Review|| by Carissa,"Hi guys, just a quick review on my new make up product. Hope you liked the video! xoxo.",Carissa,2016-07-09T13:47:32Z,3666,3.0,0.0
4d7i9UI_Fjo,Омолаживающий крем под глаза и вокруг губ Sulwhasoo Goa Eye &amp; Lip Cream,Рада рассказать про одно из своих любимых средств по уходу за кожей вокруг глаз - Sulwhasoo Goa крем для кожи век и ...,KoreanCosmeticsReview,2017-01-19T08:35:22Z,856,34.0,11.0
SONNFYndrUo,2017 Sulwhasoo Beauty Ritual Cushion,,Sulwhasoo Thailand Official,2017-04-21T03:58:52Z,217,2.0,0.0
m33-IiSDGzM,🏆 My Skincare Top 10 🏆 #shorts,Why did this take me days to narrow down ⁣⁣ ⁣#Sulwhasoo First Care Activating Serum ⁣#Somebymi AHA BHA PHA Miracle ...,Annie Wang Tamaki,2024-03-01T15:00:50Z,5341,119.0,4.0
m33-IiSDGzM,🏆 My Skincare Top 10 🏆 #shorts,Why did this take me days to narrow down ⁣⁣ ⁣#Sulwhasoo First Care Activating Serum ⁣#Somebymi AHA BHA PHA Miracle ...,Annie Wang Tamaki,2024-03-01T15:00:50Z,5341,119.0,4.0
x-dDizFI5gI,Sulwhasoo Perfecting Cushion Review and First Impression,,Camille,2016-10-10T03:36:59Z,3508,4.0,2.0
nygKe_nPCbk,Honest Review DearKlairs Midnight Blue Calming Cream #shorts #skincare #beauty #makeup #sunscreen,Honest Review DearKlairs Midnight Blue Calming Cream #shorts #skincare #beauty #makeup #sunscreen ...,BeautyEveryday,2024-06-07T11:23:12Z,17,4.0,0.0
nygKe_nPCbk,Honest Review DearKlairs Midnight Blue Calming Cream #shorts #skincare #beauty #makeup #sunscreen,Honest Review DearKlairs Midnight Blue Calming Cream #shorts #skincare #beauty #makeup #sunscreen ...,BeautyEveryday,2024-06-07T11:23:12Z,17,4.0,0.0
6Sr6Mv7gI1k,Best dewy highlight for fair/light skin?,Don't forget to enter the NEW Giveaway now up!!! https://youtu.be/R9CxxsSGS4s Products Mentioned: Sulwhasoo multi cushion ...,Melinda Joy,2018-09-09T16:00:00Z,96,6.0,5.0
H3mz_BSWyU4,VỪA CHE PHỦ CAO VỪA CHỐNG LÃO HOÁ | SULWHASOO TIME TREASURE RADIANCE SERUM CUSHION REVIEW &amp; SWATCHES,Chờ đợi 4 năm rồi giờ phút ấy cũng đến - SULWHASOO đã cho ra mắt dòng cushion chuyên dưỡng da cao cấp nhất đến từ chiết ...,The Cloud Beauty,2021-04-01T12:00:06Z,5632,69.0,21.0
skxH970Vc1s,Mommy Karenn Casil Shares Her Updated Routine for A More Youthful and Glowing Skin 💖,dewha #dewhaskin #beautytips #skincare #skincareph #makeup #antiaging #skinaging #sheetmask #antiagingserum #serum.,Dewha,2023-11-16T09:41:21Z,80,3.0,4.0
skxH970Vc1s,Mommy Karenn Casil Shares Her Updated Routine for A More Youthful and Glowing Skin 💖,dewha #dewhaskin #beautytips #skincare #skincareph #makeup #antiaging #skinaging #sheetmask #antiagingserum #serum.,Dewha,2023-11-16T09:41:21Z,80,3.0,4.0
DBxVopyZz28,NEW Sulwhasoo Perfecting Cushion &amp; Perfecting Cushion Airy,,Sulwhasoo Indonesia,2024-01-29T04:35:00Z,59617,25.0,0.0
7s02yV9rOGM,Kem nền  sulwhasoo  túi  12 goi /90k,Kem Nền Sulwhasoo Perfecting Foundation Fond De Teint Giá: #1tr470k Giá 90k túi 12g ak Kem nền chăm sóc da tạo ra một làn ...,Hong Trang-Korea Hoa,2020-09-30T02:15:44Z,156,1.0,0.0
Jp_oCBAan38,Review: Sulwhasoo Concentrated Ginseng Renewing Serum,This is an honest review of Sulwhasoo Concentrated Ginseng Renewing Serum. #review #nykaa #unboxing #skincare ...,ReviewedInIndia,2024-06-19T09:00:13Z,528,11.0,2.0
3augmzh5iuY,Blend that perfect cc cushion into your skin to achieve that glowy natural look! ✨,dewha #dewhaskin #makeup #ytshorts.,Dewha,2023-04-03T05:28:31Z,211,1.0,0.0
3augmzh5iuY,Blend that perfect cc cushion into your skin to achieve that glowy natural look! ✨,dewha #dewhaskin #makeup #ytshorts.,Dewha,2023-04-03T05:28:31Z,211,1.0,0.0
34AHTLn5t5o,Goodbye Acne and Oily Skin and Thank you Dewha Miracle Dou 💖💯,dewha #dewhaskin #makeup #ytshorts #skincare #oilyskin #acneproneskin.,Dewha,2023-04-28T09:20:26Z,816,21.0,0.0
3Cb-r6hJi5I,Be always on the go with Dewha&#39;s Miracle Glow Duo just like Yassi Pressman!,Shop here: bit.ly/3YRK5Wn Facebook: https://www.facebook.com/dewhaskin Instagram: https://www.instagram.com/dewha.co/ ...,Dewha,2023-02-22T05:44:34Z,644,4.0,0.0
mt0gw4EZhEg,The Only Facial Mask With Microcurrent Technology 😲💖,dewha #dewhaskin #beautytips #skincare #skincareph #makeup #antiaging #skinaging #sheetmask #antiagingserum #serum.,Dewha,2023-08-22T16:00:39Z,281,8.0,0.0
YXNjq6O6oyo,SULWHASOO PERFECTING CUSHION LIMITED 2016 | First Impression &amp; Review | The Cloud,SULWHASOO PERFECTING CUSHION LIMITED 2016 là cushion high-end của hãng mỹ phẩm Sulwhasoo từ tập đoàn Amore ...,The Cloud Beauty,2016-06-01T13:19:55Z,49976,448.0,
YXNjq6O6oyo,SULWHASOO PERFECTING CUSHION LIMITED 2016 | First Impression &amp; Review | The Cloud,SULWHASOO PERFECTING CUSHION LIMITED 2016 là cushion high-end của hãng mỹ phẩm Sulwhasoo từ tập đoàn Amore ...,The Cloud Beauty,2016-06-01T13:19:55Z,49976,448.0,
JSHt7bs5Nz8,Celebrities Loves the Miracle Dou from Dewha. A Make Up and a Skin Care in One  😍💖💯,dewha #dewhaskin #makeup #ytshorts #skincare.,Dewha,2023-04-25T02:05:28Z,462,8.0,0.0
9QcHnHoPL_s,Why Grace Myu loves the Sulwhasoo Perfecting Cushion,Sulwhasoo Perfecting Cushion in a glance. Now available at all Sulwhasoo counters in Malaysia from June 2015 onwards!,Grace Myu,2015-06-23T18:09:38Z,274,0.0,0.0
c-ULpfLWBSY,REVIEW: Sulwhasoo Snowise Brightening Cushion ผิวสว่างโกลว์วาว เนียนแบบธรรมชาติ เลิฟ!,Sulwhasoo ออกคุชชั่นใหม่แล้วน้าาา รู้ยังงงงง♡♡♡ วี๊ดๆๆ รุ่นนี้งอกมาจากไลน์ skincare snowise เลยเชียววว 》ถามว่าทำไมงอกจากไลน์นี้?,Cherriie Cherry,2019-07-17T17:14:30Z,1568,6.0,0.0
Hl9YQ7fM9tU,REVIEW: Sulwhasoo: &#39;Perfecting Cushion&#39; Foundation Compact,"Hi! Sorry, for the color issue. I don't know what happened :( I hope this review helped you to decide whether you want to try out this ...",Angela Ahn,2016-01-14T10:57:43Z,7545,40.0,4.0
xiq1EqRQacY,Sulwhasoo Perfecting Powder 20g,Shade Clear https://www.ebay.com/itm/194940758989 21N https://www.ebay.com/itm/194940794338 23N ...,SK E&C (skenc),2022-04-15T12:15:15Z,1246,2.0,0.0
OT14goeNfNw,"Sulwhasoo, Tatcha, and Fancl&#39;s newest products, new brands and events | Picks of the Month","For this Picks of the Month, we introduce you the latest products by Sulwhasoo that were endorsed by Song Hye Kyo, as well as ...",Daily Vanity,2019-04-12T01:25:51Z,489,5.0,0.0
z4Kklm2bKm8,Sulwhasoo Perfecting Cushion Foundation Review + Giveaway Winner Announcement!!!! | Jessica Kent,OPEN ME... Congrats to Mika & Tina Em who won the giveaway!!!! Please subscribe to join my CakeFaceFamily to see more ...,Jessica Lee Rojas Kent,2016-08-07T03:24:34Z,1571,30.0,11.0
1iv9rOvuZ6E,UNBOXING THE SULWHASOO HOLIDAY GIFT SET - LUXE GINSENG RANGE HOLLISTIC BEAUTY BRAND | MANDY SERAFINA,Today we unbox another 2022 Holiday Gift Sets! There are currently 2 sets from the Sulwhasoo range but we will be unboxing the ...,Mandy Serafina,2022-11-19T22:49:25Z,428,10.0,1.0
_IyO6-TAutM,Soosul Skin Luxury Korean Skincare - Soosul Skin Review,www.soosul.shop #soosulskin #soosul #soosulkoreanproducts The first skincare line for women of all generations. Effective and ...,Soosul Skin,2023-05-28T20:30:02Z,305,5.0,0.0
YEL3uzT-nUo,"REVIEW | Top 5 Skin Care, Winter 2015 Edition",EXPAND ♡ I know many of you have been patiently waiting for the release of this video! Hope you enjoy it xo → FOREO Day + ...,RAEview,2015-12-17T02:36:01Z,47177,672.0,61.0
JP5YHx72Io4,Feeling Old! Want to feel young forever! Start USing the Anti-aging Skincare Set,OHUI THE FIRST GENITURE DEBUTANTE COLLECTION SET   is a skin care product that Bringing vitality to your tired skin ...,Beauty Korea Dubai OFFICIAL,2022-11-09T13:23:21Z,55,0.0,0.0
sPMwLQp18Rg,The New and Improve Dewha&#39;s Perfect Glow CC Cushion with Better Coverage upto 16 hrs of Wearing ✨💖,dewha #dewhaskin #beautytips #skincare #skincareph #makeup #antiaging #skinaging #sheetmask #antiagingserum #serum ...,Dewha,2023-10-08T00:00:20Z,46,2.0,0.0
_Iaf6Qk5Glc,Sulwhasoo Perfecting Cushion Brightening,A cushion foundation for a radiant skin all day Perfecting Cushion Brightening Magnolia Flower Extract and Pearlescent complex ...,Sulwhasoo Indonesia,2016-04-06T04:50:19Z,5337,6.0,0.0
revk1uCncM0,Ai đã dùng sulwhasoo chỉ có 👍,,Duyen Le,2021-12-11T09:46:28Z,98,1.0,0.0
zd7uICHVXd8,Self Care Skincare Routine - Reviewing Sulwhasoo,"On this video, I'm on my second week of the self care skincare journey, were I try a different skincare line every 7days on a 4 week ...",Davidposh,2020-05-26T01:44:07Z,92,9.0,0.0
i2dVoEKPEgg,"Korean Cushion Foundation Review(Nature republic, Hera, Sulwhasoo,Espoir)",1. Nature republic cushion cc natural 23 2.Hera UV cushion long stay 23 3.Sulwhasoo perfection cushion brightening 23 4.Espoir ...,Eddie Sun,2015-11-04T06:36:31Z,12667,175.0,47.0
_OeSOIcPMKc,K-Beauty Unboxing ft. Amateur Aries | STYLEVANA K-BEAUTY,Nothing is more exciting than unboxing       What did Amanda have this time? Let's check them out or shop below ...,Stylevana,2021-05-25T10:00:11Z,276,3.0,
jftPUfL6GIY,"Best Lip Balm for DRY, CHAPPED LIPS | LANEIGE LIP MASK |  #shorts",A short video on LANEIGE Lip Sleeping Mask. Link to my other video: MCaffeine | Naked & Raw Coffee Under Eye Cream For ...,Skin care with Priya,2021-09-13T15:39:39Z,1790,56.0,7.0
A8BR8LqccVA,SULWHASOO UNBOXING PART2 WITH LOTS OF FREEBIES | #koreapasabuy #shorts #shortsvideo,"Legit pasabuy seller Pm for order ""Pinay Ajumma"" *We do shipping worldwide via EMS* PM lang po sa amin ~",Pinay Ajumma,2024-02-23T10:24:44Z,40,3.0,2.0
