video_id,title,description,channel,published,views,likes,comments
xMTvhUib5I8,TATCHA lip mask 🫶🏼👄#shorts #ytshorts #lipmask #beauty,"Hi Guys,      ‍♀️ ⭐ Subscribe for more videos #youtubeshorts #youtube #ytshorts #shortsvideo #shortsfeed #shorts30 ...",DailyTea🦋,2023-02-22T14:06:10Z,2443,53.0,0.0
dBOF94VChFo,Best Lip Mask   #skincareproduct #skincareroutine Tatcha Kissu Lip Mask #shorts  #makeup #sunscreen,Best Lip Mask #skincareproduct #skincareroutine Tatcha Kissu Lip Mask #shorts #makeup #sunscreen https://amzn.to/45grBTG ...,BeautyEveryday,2024-06-07T08:48:38Z,11,0.0,0.0
bOPx7Kn0hHo,Tatcha unboxing,,Hermina Tomasyan,2022-11-19T16:45:16Z,405,6.0,1.0
iLKMX94imjg,get unready with me 💤,Sharing my nighttime skincare with you all ✨ These are some of my favorite products and my skin is ✨glowing✨ in the morning ...,Lizbeth Contreras,2023-05-17T13:30:17Z,207,10.0,0.0
sYCTaAq5MIE,Trying the new Tatcha Indigo Cleansing Balm &amp; feeling oh so clean! #sephora #cleansingbalm #tatcha,,The Destiny Holder,2023-09-16T04:17:43Z,58,1.0,0.0
sYCTaAq5MIE,Trying the new Tatcha Indigo Cleansing Balm &amp; feeling oh so clean! #sephora #cleansingbalm #tatcha,,The Destiny Holder,2023-09-16T04:17:43Z,58,1.0,0.0
4A5wnpVWNH0,NEW! Tatcha Indigo Cleansing Balm,The new Indigo Cleansing Balm from @tatchabeauty is so luxurious. It literally melts onto your skin. Affiliate Link: ...,Shannon Loves Makeup,2023-07-10T12:00:03Z,1811,24.0,2.0
o_O6WdBnvIA,My Go-To Prestige Products at 30 | soothingsista,This video is in partnership with Lord Jones! Use 'STEPHANIE20' here for 20% off your purchase: https://www.,Stephanie Villa,2020-12-12T01:36:47Z,27073,730.0,44.0
rrdiGcrIx2Q,"Top 10 | Best of Skin Care, 2015 Edition",My Top 10 of 2015 in Skin → Cle de Peau Brightening Mask http://bit.ly/1mbcAwc → Guerlain Eye Masks http://bit.ly/1OQcjFm ...,RAEview,2015-12-26T18:43:24Z,77638,1049.0,2.0
nc56ILP_adY,Nighttime winter skincare routine. #winterskincare #skincareroutine,"As someone with DRY skin especially during the winter months, these are just a few of the products that keep my skin hydrated ...",Adrianne Kiara,2024-02-25T13:00:44Z,183,6.0,1.0
HXVjtfzBFTY,"EMPTIES! Reviewing the Skincare, Makeup, &amp; Body Care Products I&#39;ve Finished | Beauty with Susan Yara","I've been a long time since I've done an empties video, so I have quite a few skincare, makeup, and body care product empties to ...",Mixed Makeup,2024-02-20T14:00:11Z,63341,2010.0,149.0
zmgd6RCAz1k,Tatcha- The Kissu Lip Mask 🌸,"Tatcha- The Kissu Lip Mask This Japanese lip jelly is a non-sticky gel made of Japanese peach, Camellia oil, and Squalane that ...",Insha | The Critique Chronicles,2023-09-24T20:47:39Z,262,13.0,0.0
zmgd6RCAz1k,Tatcha- The Kissu Lip Mask 🌸,"Tatcha- The Kissu Lip Mask This Japanese lip jelly is a non-sticky gel made of Japanese peach, Camellia oil, and Squalane that ...",Insha | The Critique Chronicles,2023-09-24T20:47:39Z,262,13.0,0.0
El8OOOpd0c8,New Tatcha Silk Sunscreen #Shorts #sunscreen #skincare #beauty #makeupreview #skincareproduct,New Tatcha Silk Sunscreen #Shorts #sunscreen #skincare #beauty #makeupreview #skincareproduct https://amzn.to/3ywLJ7Q ...,BeautyEveryday,2024-05-28T09:36:46Z,12,0.0,0.0
sL5xgDu-Qh4,🎀 หรูๆ ดูแพงๆ ราคาไม่แรง 🎀🔥 Mercedes-Benz GLA 200 ปี2018 🔥,"Mercedes-Benz GLA 200 ปี2018 -รถออกห้างมือเดียว -ไม่เคยติดแก๊ส -ไมล์ 161218 km -เครื่องยนต์,เกียร์,ช่วงล่าง สมบูรณ์ -ภายในสวย ...",รถมือสองราคาถูก,2024-12-29T07:28:00Z,575,10.0,0.0
sL5xgDu-Qh4,🎀 หรูๆ ดูแพงๆ ราคาไม่แรง 🎀🔥 Mercedes-Benz GLA 200 ปี2018 🔥,"Mercedes-Benz GLA 200 ปี2018 -รถออกห้างมือเดียว -ไม่เคยติดแก๊ส -ไมล์ 161218 km -เครื่องยนต์,เกียร์,ช่วงล่าง สมบูรณ์ -ภายในสวย ...",รถมือสองราคาถูก,2024-12-29T07:28:00Z,575,10.0,0.0
A9h0T42ntXk,Tatcha The Indigo Cream Moisturiser Review,Hey guys! I'm back with a mini inside look into Tatcha's Indigo Cream. I hope you find it helpful:) Tried to make it soothing like the ...,NOON BY NICOLE,2020-07-24T12:00:07Z,4341,49.0,3.0
A9h0T42ntXk,Tatcha The Indigo Cream Moisturiser Review,Hey guys! I'm back with a mini inside look into Tatcha's Indigo Cream. I hope you find it helpful:) Tried to make it soothing like the ...,NOON BY NICOLE,2020-07-24T12:00:07Z,4341,49.0,3.0
6C6eXn6MhhM,Sulwhasoo UV Wise Brightening Multi Protector Sunscreen No 2. Milky Tone Up 50ml by Luxiface.com,"A sunscreen that provides powerful protection, yet feels mild on the skin and delivers brightening benefits This sunscreen ...",Luxiface,2023-05-09T16:49:30Z,634,6.0,0.0
6C6eXn6MhhM,Sulwhasoo UV Wise Brightening Multi Protector Sunscreen No 2. Milky Tone Up 50ml by Luxiface.com,"A sunscreen that provides powerful protection, yet feels mild on the skin and delivers brightening benefits This sunscreen ...",Luxiface,2023-05-09T16:49:30Z,634,6.0,0.0
nQ6UZg4JPw8,Doing the MOST - Travel Edition #travelskincare #over40skincare #agepositive #over40,Doing the most is a must - travel edition. When you're over 40 skincare is a must even when you're traveling. #over40 ...,The Tennille Life,2024-08-23T12:01:06Z,29796,2574.0,68.0
nQ6UZg4JPw8,Doing the MOST - Travel Edition #travelskincare #over40skincare #agepositive #over40,Doing the most is a must - travel edition. When you're over 40 skincare is a must even when you're traveling. #over40 ...,The Tennille Life,2024-08-23T12:01:06Z,29796,2574.0,68.0
sL5xgDu-Qh4,🎀 หรูๆ ดูแพงๆ ราคาไม่แรง 🎀🔥 Mercedes-Benz GLA 200 ปี2018 🔥,"Mercedes-Benz GLA 200 ปี2018 -รถออกห้างมือเดียว -ไม่เคยติดแก๊ส -ไมล์ 161218 km -เครื่องยนต์,เกียร์,ช่วงล่าง สมบูรณ์ -ภายในสวย ...",รถมือสองราคาถูก,2024-12-29T07:28:00Z,575,10.0,0.0
sL5xgDu-Qh4,🎀 หรูๆ ดูแพงๆ ราคาไม่แรง 🎀🔥 Mercedes-Benz GLA 200 ปี2018 🔥,"Mercedes-Benz GLA 200 ปี2018 -รถออกห้างมือเดียว -ไม่เคยติดแก๊ส -ไมล์ 161218 km -เครื่องยนต์,เกียร์,ช่วงล่าง สมบูรณ์ -ภายในสวย ...",รถมือสองราคาถูก,2024-12-29T07:28:00Z,575,10.0,0.0
A9h0T42ntXk,Tatcha The Indigo Cream Moisturiser Review,Hey guys! I'm back with a mini inside look into Tatcha's Indigo Cream. I hope you find it helpful:) Tried to make it soothing like the ...,NOON BY NICOLE,2020-07-24T12:00:07Z,4341,49.0,3.0
A9h0T42ntXk,Tatcha The Indigo Cream Moisturiser Review,Hey guys! I'm back with a mini inside look into Tatcha's Indigo Cream. I hope you find it helpful:) Tried to make it soothing like the ...,NOON BY NICOLE,2020-07-24T12:00:07Z,4341,49.0,3.0
El1dU9tUNnE,I see Violet C #Tatcha #VioletC #TikTokVideos #Selena,One of my beauty products is to my @tatcha #VioletC face mask. This #JBeauty gem is a treasure! The mask leaves my skin ever ...,Roxy Reviews,2019-04-15T22:40:46Z,127,3.0,0.0
XozgW56V5Ao,"SUMMER FAVOURITES-Le Labo, Sulwhasoo, Charlotte Tilbury","Hey Guys, here are all my summer favourites skin care/ make up edition ~~ hope you guys enjoy it Item List: Nivea Care ...",amanda gong,2018-08-14T21:59:45Z,514,4.0,3.0
ptApAKiYFS4,5 CURRENT SKINCARE FAVORITES | Mini Reviews,5 random skincare products I've been loving! I think all of these are helping keep my skin super clear recently. Instagram: ...,Julianne Heckel,2018-02-15T16:00:05Z,224,5.0,4.0
Nac3YACs8Go,How to Repair Your Skin Barrier (Skincare Routine) | Skin Barrier Part 2,Here it is! Part two of my skin barrier series: how to repair your skin barrier including a sample skincare routine & recommended ...,Asia Jackson,2017-12-12T02:31:37Z,73715,3226.0,206.0
STaQ3xqWSqM,DAY Skin Care Routine,PART 2 NIGHT: http://www.youtube.com/watch?v=nF7fUTRY7Lg Tatcha: http://www.tatcha.com Review: ...,kokolaroo,2012-08-04T06:58:18Z,26886,308.0,171.0
NAX10v06V_8,The &quot;Skip Care&quot; Skincare Method You Need To Know!,"WHAT IS SKIP CARE? I tell you all about The ""Skip-Care"" Skincare Routine You Need To Know. If you don't have time for a 10 ...",Jennifer Chiu,2019-07-12T16:00:12Z,19249,774.0,74.0
N35YkgR8hOI,Nykaa hot pink sale haul part 1,This haul mainly has sulwasoo products because they had an offer that was too good to miss. I got a mask and two serums and ...,Arika Tales ,2022-08-13T02:54:25Z,77,3.0,0.0
6C6eXn6MhhM,Sulwhasoo UV Wise Brightening Multi Protector Sunscreen No 2. Milky Tone Up 50ml by Luxiface.com,"A sunscreen that provides powerful protection, yet feels mild on the skin and delivers brightening benefits This sunscreen ...",Luxiface,2023-05-09T16:49:30Z,634,6.0,0.0
6C6eXn6MhhM,Sulwhasoo UV Wise Brightening Multi Protector Sunscreen No 2. Milky Tone Up 50ml by Luxiface.com,"A sunscreen that provides powerful protection, yet feels mild on the skin and delivers brightening benefits This sunscreen ...",Luxiface,2023-05-09T16:49:30Z,634,6.0,0.0
zmgd6RCAz1k,Tatcha- The Kissu Lip Mask 🌸,"Tatcha- The Kissu Lip Mask This Japanese lip jelly is a non-sticky gel made of Japanese peach, Camellia oil, and Squalane that ...",Insha | The Critique Chronicles,2023-09-24T20:47:39Z,262,13.0,0.0
zmgd6RCAz1k,Tatcha- The Kissu Lip Mask 🌸,"Tatcha- The Kissu Lip Mask This Japanese lip jelly is a non-sticky gel made of Japanese peach, Camellia oil, and Squalane that ...",Insha | The Critique Chronicles,2023-09-24T20:47:39Z,262,13.0,0.0
rHEqp0Hl_Kc,At Home Facial: Sulwhasoo,"This at home facial is suitable for anyone who desires calm, balanced skin. I tend to to do this kind of routine when I want to ...",Felicia Walker Beauty,2020-04-19T21:39:52Z,1190,73.0,23.0
gpXCV5cQ6rU,比SKII神仙水还好用却便宜一半？Tatcha Best Sellers Review聊聊北美高颜值日系风格护肤品Tatcha全线产品｜空瓶无数的真爱防晒&amp;卸妆油｜精华水眼霜山茶花精华油面膜种草拔草,Hi Loves!今天分享的是我的爱用牌Tatcha产品全面测评，使用方法、成分、使用感还有适合肤质的overall review. 希望对你们有帮助 ...,和Audrey一起运动,2020-07-19T23:13:27Z,2007,20.0,20.0
XTD6BoAsuWc,Tatcha Indigo Cleansing Balm,,Dainty Nugs,2023-08-28T19:00:32Z,736,14.0,2.0
fo1Rw4fiMY8,Tatcha Silk Peony Eye Cream #shorts #skincareproduct  #makeup #sunscreen #sunprotection  #beauty,Tatcha Silk Peony Eye Cream #shorts #skincareproduct #makeup #sunscreen #sunprotection #beauty https://amzn.to/4b7WUlj ...,BeautyEveryday,2024-06-07T08:33:26Z,22,1.0,0.0
2CTIGt1XbBg,Window shopping Sephora skincare: high-end moisturizers PT 2,"PART ONE: https://youtu.be/7KavW9kRYUI Let's go window shopping Sephora skincare for high end moisturizers from Dior, ...",Trevor Ritchie,2021-06-25T17:00:01Z,362,17.0,8.0
sYCTaAq5MIE,Trying the new Tatcha Indigo Cleansing Balm &amp; feeling oh so clean! #sephora #cleansingbalm #tatcha,,The Destiny Holder,2023-09-16T04:17:43Z,58,1.0,0.0
sYCTaAq5MIE,Trying the new Tatcha Indigo Cleansing Balm &amp; feeling oh so clean! #sephora #cleansingbalm #tatcha,,The Destiny Holder,2023-09-16T04:17:43Z,58,1.0,0.0
cRgHaV4jl5o,Tatcha潔面產品實測分享 #tatcha #實測分享 #護膚品,,Luxbeauty護膚品實測,2023-10-10T05:41:30Z,57,0.0,0.0
rOhHGia7_eY,"My Skincare Routine! Drunk Elephant, Charlotte Tilbury, Tatcha, Good Molecules, Laneige!","My Skincare Routine! Drunk Elephant, Charlotte Tilbury, Tatcha, Good Molecules, Laneige! Hello PRINTcesses! **Excited share ...",Not Fit for Print Beauty,2022-04-02T10:00:23Z,1386,115.0,104.0
h-HYlSfDs2Y,Night Time Skin Care Routine! | How to Get Glowy Skin! ✨,Want skin that glows? It's all in your night time skin care routine! Here are some products that are sure to help You do just that; ...,Maison Malli,2020-04-25T01:22:31Z,454,48.0,31.0
gjrV4QjE1a8,Tatcha產品介紹，Luxbeauty為大家實測分享,,Luxbeauty護膚品實測,2023-10-05T10:01:41Z,13,0.0,0.0
nQ6UZg4JPw8,Doing the MOST - Travel Edition #travelskincare #over40skincare #agepositive #over40,Doing the most is a must - travel edition. When you're over 40 skincare is a must even when you're traveling. #over40 ...,The Tennille Life,2024-08-23T12:01:06Z,29796,2574.0,68.0
nQ6UZg4JPw8,Doing the MOST - Travel Edition #travelskincare #over40skincare #agepositive #over40,Doing the most is a must - travel edition. When you're over 40 skincare is a must even when you're traveling. #over40 ...,The Tennille Life,2024-08-23T12:01:06Z,29796,2574.0,68.0
zWdZl1ecPcA,🏆BEST OF BEAUTY 2019: Korean Skincare Routine ft. Edward Avila,"It's that time again where Edward & I award our most-used/favorite skincare products of the year. For 2019, we challenged ...",Joan Kim,2019-11-28T00:00:10Z,308620,6682.0,723.0
fXX3nCHXCkg,Kbeauty haul from #aritaum #kbeauty #kbeautyblogger #bts #btsarmy #aritaum #sulwhasoo #innisfree,,TheSkincareAffairs,2022-06-20T03:24:55Z,100,4.0,0.0
k7q5aN8FVVI,Favorites Skincare 2021 สกินแคร์ใช้แล้วชอบประจำปี,Matsukiyo Cleansing Oil https://bit.ly/3s3TvPG #Simple Micellar Cleansing Gel Shopee : https://bit.ly/3w43Ivn Lazada ...,NAM NENA,2022-01-29T08:14:45Z,2673,71.0,2.0
42BcTPx3D5E,Order Now: https://amzn.to/3W1ITQ3 | Sulwhasoo Concentrated Ginseng Renewing Cream Classic,Order Now: https://amzn.to/3W1ITQ3 #amazon #cream #usa #viral #vlogs #trending #2023 #girl products Sulwhasoo ...,Amazon AI: The Future of Shopping,2023-05-13T07:52:28Z,72,0.0,0.0
WoLdbDIEBig,WHAT SHOULD I BUY DURING THE SEPHORA SPRING SALE? // CURRENT SEPHORA WISHLIST,WHAT SHOULD I BUY DURING THE SEPHORA SPRING SALE? CURRENT SEPHORA WISHLIST Happy Sunday! Today I am ...,Samantha March,2021-03-28T15:02:29Z,17128,,399.0
WoLdbDIEBig,WHAT SHOULD I BUY DURING THE SEPHORA SPRING SALE? // CURRENT SEPHORA WISHLIST,WHAT SHOULD I BUY DURING THE SEPHORA SPRING SALE? CURRENT SEPHORA WISHLIST Happy Sunday! Today I am ...,Samantha March,2021-03-28T15:02:29Z,17128,,399.0
XvMAjhH7hhU,"S&amp;J《SKINCARE》DRY, SENSITIVE SKIN???  MUST TRY Empties that I SWEAR by... repurchased many times!","Finally another skincare sharing from me. Its taken me a good few months to prep for this one, as I needed to really have used up ...",SARAH & JASON,2022-02-27T07:45:01Z,4273,99.0,19.0
XvMAjhH7hhU,"S&amp;J《SKINCARE》DRY, SENSITIVE SKIN???  MUST TRY Empties that I SWEAR by... repurchased many times!","Finally another skincare sharing from me. Its taken me a good few months to prep for this one, as I needed to really have used up ...",SARAH & JASON,2022-02-27T07:45:01Z,4273,99.0,19.0
J32nrn45QPc,SKINCARE DEALS 😱 | Shop with me at Tjmaxx,"Shop with me at TJ Maxx for the best skincare deals! If you are looking for quality products at an affordable prices, you need ...",Virtual Skincare Queen,2023-04-12T02:00:09Z,2616,,2.0
nF7fUTRY7Lg,NIGHT Skin Care Routine,PART 1 DAY: http://www.youtube.com/watch?v=STaQ3xqWSqM Tatcha: http://www.tatcha.com (Not an affiliate link) Review: ...,kokolaroo,2012-08-11T19:41:36Z,31349,260.0,190.0
nF7fUTRY7Lg,NIGHT Skin Care Routine,PART 1 DAY: http://www.youtube.com/watch?v=STaQ3xqWSqM Tatcha: http://www.tatcha.com (Not an affiliate link) Review: ...,kokolaroo,2012-08-11T19:41:36Z,31349,260.0,190.0
yOjq-CWXuLA,Hydrating skin care routine #skincare #skincareroutine #dryskin  #skincareproducts #luxuryskincare,Follow ​⁠​⁠@PeigyStyles for more! My hydrating travel nighttime skin care routine featuring some of my favorite luxury skincare ...,PeigyStyles,2023-07-09T22:20:14Z,820,31.0,0.0
YmijoZksYG8,Bloomstay Vitalizing Eye Cream,Sulwhasoo's 'Bloomstay Vitalizing Eye Cream' protects the eye area from skin-aging and the external stimuli of everyday lifestyles ...,Sulwhasoo Indonesia,2020-04-03T07:08:06Z,1216,16.0,0.0
YmijoZksYG8,Bloomstay Vitalizing Eye Cream,Sulwhasoo's 'Bloomstay Vitalizing Eye Cream' protects the eye area from skin-aging and the external stimuli of everyday lifestyles ...,Sulwhasoo Indonesia,2020-04-03T07:08:06Z,1216,16.0,0.0
5vfPu-BbmTc,Best Eye Creams &amp; Serums | Gothamista,"Here are some of my thoughts about eye products and of course, my personal favourites! Get comfy because, it's a long one!",Gothamista,2016-05-15T10:00:00Z,953855,13226.0,792.0
5vfPu-BbmTc,Best Eye Creams &amp; Serums | Gothamista,"Here are some of my thoughts about eye products and of course, my personal favourites! Get comfy because, it's a long one!",Gothamista,2016-05-15T10:00:00Z,953855,13226.0,792.0
UbA-W20YyDw,Tatcha Luminous Dewy Skin Mask Review +Demo | Tracey Violet,Price: $12 USD Purchase it here at Sephora https://bit.ly/3jPcMQy Where Else To Find Me! I N S T A G R A M @traceytsang ...,Tracey Violet ,2021-03-02T01:00:16Z,291,,11.0
KooQj3YpRFQ,My non-negotiable skincare routine,,Christxiee,2024-03-01T02:55:57Z,19738,619.0,26.0
KooQj3YpRFQ,My non-negotiable skincare routine,,Christxiee,2024-03-01T02:55:57Z,19738,619.0,26.0
ZX6PNbxjY3c,"SKINCARE BEAUTY EMPTIES: Missha, Dior, Tacha, Fresh,  Sulwhasoo, Kate Summerville &amp; more | Fall 2022","SKINCARE BEAUTY EMPTIES: Missha, Dior, Tacha, Fresh, Sulwhasoo, Kate Summerville & more… This Video is *NOT ...",Jennie Modesto,2022-10-19T04:23:26Z,78,9.0,4.0
luSUL-kV7vU,CURRENT SKINCARE ROUTINE FOR GLOWING SKIN✨ | Go to Bed with Me,GIVEAWAY! Like and leave a comment telling me anything! I'll be picking a random winner to win the Tatcha The Essence ...,IAMKARENO,2019-03-26T17:00:07Z,60986,2401.0,243.0
luSUL-kV7vU,CURRENT SKINCARE ROUTINE FOR GLOWING SKIN✨ | Go to Bed with Me,GIVEAWAY! Like and leave a comment telling me anything! I'll be picking a random winner to win the Tatcha The Essence ...,IAMKARENO,2019-03-26T17:00:07Z,60986,2401.0,243.0
6JwKk0Q6QCM,#grwm with a super Bright @colourpopcosmetics Blush,grwm to go to work and then head to finally transfer my license from one state to another @sulwhasoo.us First Activing Serum ...,AurasMakeupBox,2023-05-14T16:00:03Z,1090,36.0,0.0
uenO_ZE5eHo,Amazing New Skin Care Discovery!!,TATCHA: http://www.tatcha.com Vicky's Interview: ...,kokolaroo,2012-07-06T07:21:19Z,50040,387.0,229.0
uenO_ZE5eHo,Amazing New Skin Care Discovery!!,TATCHA: http://www.tatcha.com Vicky's Interview: ...,kokolaroo,2012-07-06T07:21:19Z,50040,387.0,229.0
hKV9pqtCHdM,New year Resolutions 2017|| Skin Care and Chatty video,The opinions in the video are based on my experiences. This is the truth as I see it as a consumer and not a cosmetic ...,Jacklyn of all trades,2016-12-10T20:19:44Z,3427,21.0,8.0
zEkRO1uYhW0,Sulwhasoo Bloomstay Vitalizing Serum | Sulwhasoo Thailand,ปลุกความอ่อนเยาว์ให้กับผิวและเพิ่มความกระจ่างใสอย่างมีชีวิตชีวาไปกับ Bloomstay Vitalizing กลุ่มสกินแคร์ใหม่ล่าสุดจากโซลวาซู ...,혜교 | 𝓱𝔂𝓮𝓴𝔂𝓸,2020-08-05T05:12:01Z,1095,1.0,0.0
xaF5JiVLtNo,Productos Carísimos de París Para La Piel Que Si Sirven,Productos caros para la piel que si sirven. Lotion P50 Rescue Spa Amore pacific https://go.magik.ly/ml/xfuf/ Mascarilla de Tatcha ...,Yasmany,2020-05-30T01:00:22Z,43736,2026.0,177.0
QSyVqjRqMVw,What does tailgating mean to you?! 🇸🇬 #shorts,Sephora Collection Triple Action Micellar Water RM 89.00 SGD 25.05 Sulwahsoo Gentle Cleansing Oil RM 86.00 SGD 16.87 Dr.,Miki Rai,2024-03-01T17:15:00Z,129972,5106.0,41.0
NJL9Qhk9mIo,HAUL | Fall/Winter Beauty Shopping + Weight Loss,EXPAND! Watch my at-home blow out tutorial here http://bit.ly/1SsQRcy → Guerlain Eye Serum http://bit.ly/1H2AfIl → Bakel Eye ...,RAEview,2015-11-15T00:58:38Z,33462,768.0,48.0
xq_dcwa7ZnQ,TATCHA Indigo Overnight Repair REVIEW - My new go-to skin cream for sensitive skin!,The Latest and Greatest. Need a new skin cream that will protect your skin's barrier? Look no further! TATCHA INDIGO ...,Courtney’s Journey,2022-11-27T00:42:17Z,486,5.0,2.0
xq_dcwa7ZnQ,TATCHA Indigo Overnight Repair REVIEW - My new go-to skin cream for sensitive skin!,The Latest and Greatest. Need a new skin cream that will protect your skin's barrier? Look no further! TATCHA INDIGO ...,Courtney’s Journey,2022-11-27T00:42:17Z,486,5.0,2.0
EKF_HHyIwCc,Korean Skincare vs. Japanese Skincare #shorts,The difference between Korean skincare & Japanese skincare explained in less than a minute. #shorts. Follow me on Tiktok for ...,Erika Saenz,2021-07-04T09:26:35Z,64816,2596.0,8.0
CS907gNzWWQ,Tatcha護唇產品實測分享 #tatcha #唇霜 #護膚品 #實測,,Luxbeautyhk,2023-10-10T06:14:49Z,50,0.0,0.0
RoMeK9qb0R4,珍稀白蔘高效能量超越美白極限  層層煥出“澎•彈•透•亮”,《Sulwhasoo雪花秀》以獨特韓方美顏思維重新定義美白保養觀─澎、彈、透、亮(Volume Brightening)！ 運用獨家珍稀白蔘煥白之 ...,Sulwhasoo Taiwan 雪花秀 Official,2017-02-21T02:15:10Z,528,0.0,0.0
p-Upmph0KA8,SEPHORA VIB SALE  HAUL | BLACK FRIDAY RECOMMENDATIONS| LANEIGE HERBIVORE NARS SUPERGOOP TATCHA,"HELLO MY BEAUTIFUL ROOMIES HOPE YOU ENJOYED Ana Luisa is currently running an exclusive Black Friday sale, get ...",Elyssa brand,2020-11-23T18:30:04Z,798,14.0,8.0
OVIURq5X1NQ,走入TATCHA日式御膚美學期間限定店✨ 實試THE ESSENCE #昇肌水💜｜she.com,以日式御膚美學為藍本的護膚品牌TATCHA，由即日起至9月15日於連卡佛IFC Mall設置期間限定店    ，充滿詩意又極具特色的日本 ...,she.com,2022-08-31T12:00:16Z,424,0.0,0.0
1X9IApxEkJo,Tatcha Gold Collection!,"Tatcha's Website: http://www.tatcha.com/ As Always, Thanks So Much For Watching Guys!! Products were sent to me by my lovely ...",kokolaroo,2013-08-12T18:15:24Z,4293,70.0,82.0
MilUNAB487Q,【豪华中样】Sulwhasoo雪花秀 润燥精华 润致焕活精华肌底液 30ml 补水保湿/提亮肤色,去黄，维稳，抗衰，修护肌底新生，后续护肤吸收加倍！,HongMall,2023-01-20T18:20:03Z,1153,5.0,0.0
I8JPIoNXwKc,【岑麗香遇見Tatcha Classic Ritual | 體現日式御膚美學】,與岑麗香投入身心療癒之旅︱ #TheTatchaJourney 限定E-POPUP隆重開幕】 登記領取經典亮肌體驗套裝*: https://bit.ly/2GKdu2x 為 ...,Tatcha Hong Kong,2020-10-15T01:12:23Z,67596,3.0,0.0
I8JPIoNXwKc,【岑麗香遇見Tatcha Classic Ritual | 體現日式御膚美學】,與岑麗香投入身心療癒之旅︱ #TheTatchaJourney 限定E-POPUP隆重開幕】 登記領取經典亮肌體驗套裝*: https://bit.ly/2GKdu2x 為 ...,Tatcha Hong Kong,2020-10-15T01:12:23Z,67596,3.0,0.0
rmkWh9jv1S8,KOREAN SKINCARE I&#39;VE BEEN LOVING 😜💕,Instagram: https://www.instagram.com/joanday/ Twitter: http://twitter.com/joankeem Vlog Channel: ...,Joan Kim,2019-05-02T23:00:05Z,177022,4364.0,266.0
zMFdtu7DXms,"Confidence with Sulwhasoo, starring Carmen Ow","Confidence is one of those things anyone is lucky to have. It's like a superpower, that the rest can only dream of. But if you think it ...",Prestige Thailand,2018-02-12T12:12:44Z,605,0.0,0.0
WoLdbDIEBig,WHAT SHOULD I BUY DURING THE SEPHORA SPRING SALE? // CURRENT SEPHORA WISHLIST,WHAT SHOULD I BUY DURING THE SEPHORA SPRING SALE? CURRENT SEPHORA WISHLIST Happy Sunday! Today I am ...,Samantha March,2021-03-28T15:02:29Z,17128,,399.0
WoLdbDIEBig,WHAT SHOULD I BUY DURING THE SEPHORA SPRING SALE? // CURRENT SEPHORA WISHLIST,WHAT SHOULD I BUY DURING THE SEPHORA SPRING SALE? CURRENT SEPHORA WISHLIST Happy Sunday! Today I am ...,Samantha March,2021-03-28T15:02:29Z,17128,,399.0
GWS6J3rV7cM,ASMR Skincare Unboxing 🌷✨ #asmr #skincare #shorts #unboxing #skincareroutine,asmrsounds #shortsvideo #ytshorts #shortsindia #laneige #clinique #etude #sulwhasoo #koreanskincare #lipsleepingmask.,Shruti Talekar,2023-09-04T16:36:49Z,1396,43.0,2.0
Dly5qk0EJwo,Hera sulwhasoo amore pacific chuẩn hãng,,Khanh Nguyen,2021-09-26T14:28:33Z,48,1.0,0.0
XvMAjhH7hhU,"S&amp;J《SKINCARE》DRY, SENSITIVE SKIN???  MUST TRY Empties that I SWEAR by... repurchased many times!","Finally another skincare sharing from me. Its taken me a good few months to prep for this one, as I needed to really have used up ...",SARAH & JASON,2022-02-27T07:45:01Z,4273,99.0,19.0
XvMAjhH7hhU,"S&amp;J《SKINCARE》DRY, SENSITIVE SKIN???  MUST TRY Empties that I SWEAR by... repurchased many times!","Finally another skincare sharing from me. Its taken me a good few months to prep for this one, as I needed to really have used up ...",SARAH & JASON,2022-02-27T07:45:01Z,4273,99.0,19.0
uh5r77Ufavc,SULWHASOO EVEREFINE CREAM &amp; BLOOMSTAY SERUM REVIEW | PHILIPPINES 🇵🇭,"Hi Peeps! I'm Cessy and welcome to my channel! :) if you're new to this channel, please don't forget to click SUBSCRIBE and the ...",Princess Mariz L.,2020-01-18T17:45:31Z,2010,121.0,12.0
sorji0yiSZA,2023 年度最愛護膚品來了🔥My 2023 fav skin care products | Chinchin c,FOLLOW ME: CHINCHIN: ➤Facebook: https://www.facebook.com/chinchinccccc/ ...,CHINCHIN C,2024-03-05T13:46:15Z,50609,638.0,97.0
nF7fUTRY7Lg,NIGHT Skin Care Routine,PART 1 DAY: http://www.youtube.com/watch?v=STaQ3xqWSqM Tatcha: http://www.tatcha.com (Not an affiliate link) Review: ...,kokolaroo,2012-08-11T19:41:36Z,31349,260.0,190.0
nF7fUTRY7Lg,NIGHT Skin Care Routine,PART 1 DAY: http://www.youtube.com/watch?v=STaQ3xqWSqM Tatcha: http://www.tatcha.com (Not an affiliate link) Review: ...,kokolaroo,2012-08-11T19:41:36Z,31349,260.0,190.0
